"Schildt M.; Cuypers J.L.; Shamovich M.; Herzogenrath S.T.; Malhotra A.; van Treeck C.A.; Frisch J.","Schildt, Maximilian (57412162600); Cuypers, Johannes Linus (58534008000); Shamovich, Maxim (57224313813); Herzogenrath, Sonja Tamara (58535094300); Malhotra, Avichal (57224308964); van Treeck, Christoph Alban (13609211300); Frisch, Jérôme (36196390800)","57412162600; 58534008000; 57224313813; 58535094300; 57224308964; 13609211300; 36196390800","On the Potential of District-Scale Life Cycle Assessments of Buildings","2023","Energies","16","15","5639","","","","0","10.3390/en16155639","https://www.scopus.com/inward/record.uri?eid=2-s2.0-85167781692&doi=10.3390%2fen16155639&partnerID=40&md5=e6a0b92399b0b49e00ef49f004b35d26","Institute of Energy Efficiency and Sustainable Building E3D, RWTH Aachen University, Aachen, 52074, Germany","Schildt M., Institute of Energy Efficiency and Sustainable Building E3D, RWTH Aachen University, Aachen, 52074, Germany; Cuypers J.L., Institute of Energy Efficiency and Sustainable Building E3D, RWTH Aachen University, Aachen, 52074, Germany; Shamovich M., Institute of Energy Efficiency and Sustainable Building E3D, RWTH Aachen University, Aachen, 52074, Germany; Herzogenrath S.T., Institute of Energy Efficiency and Sustainable Building E3D, RWTH Aachen University, Aachen, 52074, Germany; Malhotra A., Institute of Energy Efficiency and Sustainable Building E3D, RWTH Aachen University, Aachen, 52074, Germany; van Treeck C.A., Institute of Energy Efficiency and Sustainable Building E3D, RWTH Aachen University, Aachen, 52074, Germany; Frisch J., Institute of Energy Efficiency and Sustainable Building E3D, RWTH Aachen University, Aachen, 52074, Germany","Climate neutrality goals in the building sector require a large-scale estimation of environmental impacts for various stakeholders. Life Cycle Assessment (LCA) is a viable method for this purpose. However, its high granularity, and subsequent data requirements and effort, hinder its propagation, and potential employment of Machine Learning (ML) applications on a larger scale. The presented paper outlines the current state of research and practice on district-scale building LCA in terms of standards, software and certifications, and data availability. For this matter, the authors present the development and application of two district-scale LCA tools, Teco and DisteLCA, to determine the Global Warming Potential (GWP) of three different residential districts. Both tools employ data based on (including, but not limited to) CityGML, TABULA, and ÖKOBAUDAT. The results indicate that DisteLCA’s granular approach leads to an overestimation of environmental impacts, which can be derived from the statistical approach to operational energy use and related emissions. While both tools lead to substantial time savings, Teco requires less manual effort. The linkage of the aforementioned data sources has proven laborious and could be alleviated with a common data framework. Furthermore, large-scale data analysis could substantially increase the viability of the presented approach. © 2023 by the authors.","CityGML; global warming potential (GWP); life cycle assessment (LCA); reduced-order modelling (ROM); urban building energy modelling (UBEM)","Buildings; Data reduction; Energy utilization; Environmental impact; Global warming; Building energy model; CityGML; Global warming potential; Life cycle assessment; Reduced order modelling; Reduced-order model; Reduced-order modeling; Urban building energy modeling; Urban buildings; Life cycle","","","J. Frisch; Institute of Energy Efficiency and Sustainable Building E3D, RWTH Aachen University, Aachen, 52074, Germany; email: frisch@e3d.rwth-aachen.de","","Multidisciplinary Digital Publishing Institute (MDPI)","19961073","","","","English","Energies","Article","Final","All Open Access; Gold Open Access","Scopus","2-s2.0-85167781692"
"Hong T.; Wang Z.; Luo X.; Zhang W.","Hong, Tianzhen (7202830430); Wang, Zhe (56176432100); Luo, Xuan (57193006652); Zhang, Wanni (57212675884)","7202830430; 56176432100; 57193006652; 57212675884","State-of-the-art on research and applications of machine learning in the building life cycle","2020","Energy and Buildings","212","","109831","","","","233","10.1016/j.enbuild.2020.109831","https://www.scopus.com/inward/record.uri?eid=2-s2.0-85079105010&doi=10.1016%2fj.enbuild.2020.109831&partnerID=40&md5=6691f41ab7a5fb80fca1e22b115e8733","Building Technology and Urban Systems Division, Lawrence Berkeley National Laboratory, One Cyclotron Road, Berkeley, 94720, CA, United States","Hong T., Building Technology and Urban Systems Division, Lawrence Berkeley National Laboratory, One Cyclotron Road, Berkeley, 94720, CA, United States; Wang Z., Building Technology and Urban Systems Division, Lawrence Berkeley National Laboratory, One Cyclotron Road, Berkeley, 94720, CA, United States; Luo X., Building Technology and Urban Systems Division, Lawrence Berkeley National Laboratory, One Cyclotron Road, Berkeley, 94720, CA, United States; Zhang W., Building Technology and Urban Systems Division, Lawrence Berkeley National Laboratory, One Cyclotron Road, Berkeley, 94720, CA, United States","Fueled by big data, powerful and affordable computing resources, and advanced algorithms, machine learning has been explored and applied to buildings research for the past decades and has demonstrated its potential to enhance building performance. This study systematically surveyed how machine learning has been applied at different stages of building life cycle. By conducting a literature search on the Web of Knowledge platform, we found 9579 papers in this field and selected 153 papers for an in-depth review. The number of published papers is increasing year by year, with a focus on building design, operation, and control. However, no study was found using machine learning in building commissioning. There are successful pilot studies on fault detection and diagnosis of HVAC equipment and systems, load prediction, energy baseline estimate, load shape clustering, occupancy prediction, and learning occupant behaviors and energy use patterns. None of the existing studies were adopted broadly by the building industry, due to common challenges including (1) lack of large scale labeled data to train and validate the model, (2) lack of model transferability, which limits a model trained with one data-rich building to be used in another building with limited data, (3) lack of strong justification of costs and benefits of deploying machine learning, and (4) the performance might not be reliable and robust for the stated goals, as the method might work for some buildings but could not be generalized to others. Findings from the study can inform future machine learning research to improve occupant comfort, energy efficiency, demand flexibility, and resilience of buildings, as well as to inspire young researchers in the field to explore multidisciplinary approaches that integrate building science, computing science, data science, and social science. © 2020 Elsevier B.V.","Artificial intelligence; Building control; Building life cycle; Building performance; Buildings; Machine learning","Architectural design; Artificial intelligence; Buildings; Construction industry; Energy efficiency; Energy utilization; Fault detection; Green computing; Labeled data; Learning systems; Life cycle; Social computing; Social sciences computing; Structural design; Building controls; Building life cycle; Building performance; Fault detection and diagnosis; Machine learning research; Model transferabilities; Multi-disciplinary approach; Research and application; Machine learning","U.S. Department of Energy, USDOE, (DE-AC02-05CH11231); Office of Science, SC; Lawrence Berkeley National Laboratory, LBNL; Laboratory Directed Research and Development, LDRD","This work was supported by Laboratory Directed Research and Development (LDRD) funding from Lawrence Berkeley National Laboratory , provided by the Director, Office of Science, of the U.S. Department of Energy under Contract No. DE-AC02-05CH11231 .","T. Hong; Building Technology and Urban Systems Division, Lawrence Berkeley National Laboratory, Berkeley, One Cyclotron Road, 94720, United States; email: thong@lbl.gov","","Elsevier Ltd","03787788","","ENEBD","","English","Energy Build.","Review","Final","All Open Access; Bronze Open Access","Scopus","2-s2.0-85079105010"
"Gao X.; Pishdad-Bozorgi P.; Shelden D.R.; Hu Y.","Gao, Xinghua (57199061792); Pishdad-Bozorgi, Pardis (55336914100); Shelden, Dennis R. (24449549000); Hu, Yuqing (57202533465)","57199061792; 55336914100; 24449549000; 57202533465","Machine Learning Applications in Facility Life-Cycle Cost Analysis: A Review","2019","Computing in Civil Engineering 2019: Smart Cities, Sustainability, and Resilience - Selected Papers from the ASCE International Conference on Computing in Civil Engineering 2019","","","","267","274","7","12","10.1061/9780784482445.034","https://www.scopus.com/inward/record.uri?eid=2-s2.0-85068781307&doi=10.1061%2f9780784482445.034&partnerID=40&md5=a7e0741689a30124bb7d345edc120d4d","School of Building Construction, Georgia Institute of Technology, 280 Ferst Dr., Atlanta, 30332, GA, United States; Digital Building Laboratory, School of Architecture, Georgia Institute of Technology, 245 4th St. NW, Atlanta, 30332, GA, United States","Gao X., School of Building Construction, Georgia Institute of Technology, 280 Ferst Dr., Atlanta, 30332, GA, United States; Pishdad-Bozorgi P., School of Building Construction, Georgia Institute of Technology, 280 Ferst Dr., Atlanta, 30332, GA, United States; Shelden D.R., Digital Building Laboratory, School of Architecture, Georgia Institute of Technology, 245 4th St. NW, Atlanta, 30332, GA, United States; Hu Y., School of Building Construction, Georgia Institute of Technology, 280 Ferst Dr., Atlanta, 30332, GA, United States","A large amount of resources are spent on constructing new facilities and maintaining the existing ones. The total cost of facility ownership can be minimized by focusing on reducing the facilities life-cycle costs (LCCs) rather than the initial design and construction costs. With the developments of machine learning in predictive analytics and the utilizing building systems that provide ubiquitous sensing and metering devices, new opportunities have emerged for architecture, engineering, construction, and operation (AECO) professionals to obtain a deeper level of knowledge on buildings' LCCs. This paper provides a state-of-the-art overview of the various machine learning applications in the facility LCC analysis field. This paper aims to present current machine learning for LCC research developments, analyze research trends, and identify promising future research directions. © 2019 American Society of Civil Engineers.","Cost Prediction; Data Mining; Facilities Management; Life Cycle Cost Analysis (LCCA); Machine Learning","Cost accounting; Costs; Data mining; Engineering education; Facilities; Learning systems; Life cycle; Machine learning; Predictive analytics; Smart city; Sustainable development; Cost prediction; Facilities management; Facility life cycle; Future research directions; Life-cycle cost analysis; Machine learning applications; Research development; State of the art; Cost benefit analysis","","","","Cho Y.K.; Leite F.; Behzadan A.; Wang C.","American Society of Civil Engineers (ASCE)","","978-078448244-5","","","English","Comput. Civ. Eng.: Smart Cities, Sustain., Resil. - Sel. Pap. ASCE Int. Conf. Comput. Civ. Eng.","Conference paper","Final","","Scopus","2-s2.0-85068781307"
"Gachkar D.; Gachkar S.; García Martínez A.; Angulo C.; Aghlmand S.; Ahmadi J.","Gachkar, Darya (57248869100); Gachkar, Sadaf (57292639700); García Martínez, Antonio (36957491500); Angulo, Cecilio (23090235000); Aghlmand, Soheila (57221202917); Ahmadi, Javad (57219562595)","57248869100; 57292639700; 36957491500; 23090235000; 57221202917; 57219562595","Artificial intelligence in building life cycle assessment","2024","Architectural Science Review","","","","","","","2","10.1080/00038628.2024.2350491","https://www.scopus.com/inward/record.uri?eid=2-s2.0-85192982213&doi=10.1080%2f00038628.2024.2350491&partnerID=40&md5=c795eaa2b1db3c9a35b5216544db4a98","Escuela Técnica Superior de Arquitectura, Universidad de Sevilla, Sevilla, Spain; TEP 130 Research Group, Instituto Universitario de Arquitectura y Ciencias de la Construcción IUACC, Escuela Técnica Superior de Arquitectura, Universidad de Sevilla, Sevilla, Spain; Intelligent Data Science and Artificial Intelligence Research Centre, Universitat Politècnica de Catalunya, Barcelona, Spain; Department of Architecture and Urbanism, Islamic Azad University Tabriz Branch, Tabriz, Iran; High Performance Architecture Lab (HAL), Department of Architecture, Tarbiat Modares University, Tehran, Iran","Gachkar D., Escuela Técnica Superior de Arquitectura, Universidad de Sevilla, Sevilla, Spain; Gachkar S., Escuela Técnica Superior de Arquitectura, Universidad de Sevilla, Sevilla, Spain; García Martínez A., TEP 130 Research Group, Instituto Universitario de Arquitectura y Ciencias de la Construcción IUACC, Escuela Técnica Superior de Arquitectura, Universidad de Sevilla, Sevilla, Spain; Angulo C., Intelligent Data Science and Artificial Intelligence Research Centre, Universitat Politècnica de Catalunya, Barcelona, Spain; Aghlmand S., Department of Architecture and Urbanism, Islamic Azad University Tabriz Branch, Tabriz, Iran; Ahmadi J., High Performance Architecture Lab (HAL), Department of Architecture, Tarbiat Modares University, Tehran, Iran","As the world’s population becomes increasingly urbanized, the building sector is expected to consume even more energy and resources, exacerbating environmental damage. Life cycle Inventory Assessment is one of the main stages of Life Cycle Assessment (LCA) and it is a methodology for quantifying the environmental impacts of buildings and other assets on the environment. We propose a literature review for examining the potential for Artificial Intelligence (AI) to improve the LCA of buildings. In particular, by incorporating AI into the process, it is checked that more accurate predictive modelling is enabled and the time needed for data gathering can be reduced. However, it is also noted that many challenges remain and must be still addressed, such as the need for standardized data and the risk of bias in AI algorithms. Despite these latter open challenges, it can be concluded that AI can significantly enhance sustainability in the building sector. Highlights Potential for AI to improve the life cycle assessment of buildings and reduce the time needed for data gathering. AI can significantly enhance sustainability in the building sector, but there are still open challenges that must be addressed. The use of AI techniques, such as machine learning and neural networks, for data collection can help gather more accurate and relevant data for LCI. © 2024 Informa UK Limited, trading as Taylor & Francis Group.","artificial intelligence (AI); buildings; environmental impact; Life cycle assessment; renewable energy; sustainability","Artificial intelligence; Environmental impact; Life cycle; Sustainable development; Artificial intelligence; Building life cycle; Buildings sector; Data gathering; Energy; Environmental damage; In-buildings; Life cycle assessment; Life Cycle Inventory; Renewable energies; Buildings","","","S. Gachkar; Escuela Técnica Superior de Arquitectura, Universidad de Sevilla, Sevilla, 41012, Spain; email: sadgac@alum.us.es","","Taylor and Francis Ltd.","00038628","","ASRVA","","English","Archit Sci Rev","Review","Article in press","","Scopus","2-s2.0-85192982213"
"Das S.; Shiva S.","Das, Saikat (57207867464); Shiva, Sajjan (7004561032)","57207867464; 7004561032","Machine Learning application lifecycle augmented with explanation and security","2021","2021 IEEE 12th Annual Ubiquitous Computing, Electronics and Mobile Communication Conference, UEMCON 2021","","","","171","177","6","6","10.1109/UEMCON53757.2021.9666619","https://www.scopus.com/inward/record.uri?eid=2-s2.0-85125197035&doi=10.1109%2fUEMCON53757.2021.9666619&partnerID=40&md5=59b6d5fe0b8358ac884217f13f3a66d0","Midwestern State University, Department of Computer Science, Wichita Falls, 76308, TX, United States; University of Memphis, Department of Computer Science, Memphis, 38152, TN, United States","Das S., Midwestern State University, Department of Computer Science, Wichita Falls, 76308, TX, United States; Shiva S., University of Memphis, Department of Computer Science, Memphis, 38152, TN, United States","We have developed a Distributed Denial of Service (DDoS) intrusion detection framework that employs ML ensembles of both supervised and unsupervised classifiers that are complementary in reaching a corroborated classification decision. Our work has been limited to DDoS attack detection techniques. We propose to extend our framework to general ML system development, based on our review of current ML system development life cycles. We also propose to augment the general life cycle model to include security features to enable building security-in as the development progresses and bolt security-on as flaws are discovered after deployment. Most ML systems today operate in a black-box mode, providing users with only the predictions without associated reasoning as to how the predictions are brought about. There is heavy emphasis now to build mechanisms that help the user develop higher confidence in accepting the predictions of ML systems. Such explainability feature of ML model predictions is a must for critical systems. We also propose to augment our lifecycle model with explainability features. Thus, our ultimate goal is to develop a generic ML lifecycle process augmented with security and explainability features. Such an ML lifecycle process will be of immense use in ML systems development for all domains.  © 2021 IEEE.","Explanation augmented ML life cycle; Machine learning life cycle; MLOpS; Security augmented ML life cycle","Computer aided instruction; Denial-of-service attack; Forecasting; Intrusion detection; Machine learning; Network security; Application Lifecycle; Distributed denial of service; Explanation augmented ML life cycle; Life cycle model; Life-cycle process; Machine learning applications; Machine learning life cycle; MLOpS; Security augmented ML life cycle; System development; Life cycle","U.S. Department of Homeland Security, DHS; Air Force Institute of Technology, AFIT","This work was partially supported by a DHS/AFIT grant. We also thank Priyanka Chilakalapudi for her assistance in gathering the material on related works.","","Paul R.","Institute of Electrical and Electronics Engineers Inc.","","978-166540690-1","","","English","IEEE Annu. Ubiquitous Comput., Electron. Mob. Commun. Conf., UEMCON","Conference paper","Final","","Scopus","2-s2.0-85125197035"
"Baehr J.; Koyamparambath A.; Dos Reis E.; Weyand S.; Binnig C.; Schebek L.; Sonnemann G.","Baehr, Julian (57926154500); Koyamparambath, Anish (57349116300); Dos Reis, Eduardo (59422555700); Weyand, Steffi (57209337073); Binnig, Carsten (16548747700); Schebek, Liselotte (6602580349); Sonnemann, Guido (7003498715)","57926154500; 57349116300; 59422555700; 57209337073; 16548747700; 6602580349; 7003498715","Predicting product life cycle environmental impacts with machine learning: Uncertainties and implications for future reporting requirements","2024","Sustainable Production and Consumption","52","","","511","526","15","1","10.1016/j.spc.2024.11.005","https://www.scopus.com/inward/record.uri?eid=2-s2.0-85210008295&doi=10.1016%2fj.spc.2024.11.005&partnerID=40&md5=6489ca868a615c7147cb177c04c19b23","Institute IWAR Material Flow Management and Resource Economy, Technical University of Darmstadt, Franziska-Braun-Straße 7, Darmstadt, 64287, Germany; Université de Bordeaux, CNRS, Bordeaux, INP, ISM, UMR 5255, Talence, F-33400, France; Computer Science Department, Technical University of Darmstadt, Hochschulstr. 10, Darmstadt, 64289, Germany","Baehr J., Institute IWAR Material Flow Management and Resource Economy, Technical University of Darmstadt, Franziska-Braun-Straße 7, Darmstadt, 64287, Germany; Koyamparambath A., Université de Bordeaux, CNRS, Bordeaux, INP, ISM, UMR 5255, Talence, F-33400, France; Dos Reis E., Computer Science Department, Technical University of Darmstadt, Hochschulstr. 10, Darmstadt, 64289, Germany; Weyand S., Institute IWAR Material Flow Management and Resource Economy, Technical University of Darmstadt, Franziska-Braun-Straße 7, Darmstadt, 64287, Germany; Binnig C., Computer Science Department, Technical University of Darmstadt, Hochschulstr. 10, Darmstadt, 64289, Germany; Schebek L., Institute IWAR Material Flow Management and Resource Economy, Technical University of Darmstadt, Franziska-Braun-Straße 7, Darmstadt, 64287, Germany; Sonnemann G., Université de Bordeaux, CNRS, Bordeaux, INP, ISM, UMR 5255, Talence, F-33400, France","With the introduction of the European Green Deal, companies must increasingly report the environmental impacts of their products using life cycle assessment methodology. Since the number of products in a company's portfolio can include thousands of different products, there is an urgent need for faster ways to estimate impact hotspots and to ultimately obtain adequate inventories. In recent years machine learning (ML) has emerged as a promising strategy to tackle cost- and resource-prohibitive accounting practices. However, to be practically applied, new concepts must not only be built on a large data basis allowing to predict diverse products with varying reference flows, but they must also ensure high data quality by reflecting different types of uncertainties. Therefore, in this publication we pursued three distinct objectives: building on digitized environmental product declarations, we first predicted life cycle environmental impacts with artificial neural networks (ANN) and second performed an in-depth characterization of uncertainty and sensitivity analysis methods to identify which methods can analyze what uncertainty types. Based on this analysis, we chose residual Gaussian Process Regression (rGPR) as suitable uncertainty analysis method and employed, in a third step, an advanced ANN-rGPR hybrid model to quantify associated model uncertainties. While our final model derived high prediction performances and low model uncertainties across a large impact range, we conclude that the practical use of ML-based predictions remains limited, as long as reported product disclosures lack critical modeling specifications. However, if future reporting requirements comprehensively demanded such information, ML models could conceptually incorporate this information, thereby not only substantially improving the data quality but also the feasibility of practical implementation. © 2024 The Authors","Artificial neural network; Environmental product declaration; Greenhouse gas accounting; Machine learning; Prediction; Uncertainty analysis","Analysis method; Data quality; Environmental product declarations; Gaussian process regression; Greenhouse gas accountings; Life-cycle environmental impact; Machine-learning; Modeling uncertainties; Neural-networks; Uncertainty; Life cycle assessment","Merck Sustainability Hub; Naeem Adibi and Carolina Szablewski Colli","The research of TU Darmstadt was conducted within the Merck Sustainability Hub 2021\u20132023, a joint research platform of Merck and TU Darmstadt. The authors would like to thank all members of the Merck Sustainability Hub, as well as Naeem Adibi and Carolina Szablewski Colli, for the ongoing interactive and lively discussions, which were a great help in deriving the concepts for this study.","J. Baehr; Institute IWAR Material Flow Management and Resource Economy, Technical University of Darmstadt, Darmstadt, Franziska-Braun-Straße 7, 64287, Germany; email: j.baehr@iwar.tu-darmstadt.de","","Elsevier B.V.","23525509","","","","English","Sustain. Prod. Consum.","Review","Final","All Open Access; Hybrid Gold Open Access","Scopus","2-s2.0-85210008295"
