"Hu S.; Lei X.","Hu, Shuling (57202114651); Lei, Xiaoming (57190377935)","57202114651; 57190377935","Machine learning and genetic algorithm-based framework for the life-cycle cost-based optimal design of self-centering building structures","2023","Journal of Building Engineering","78","","107671","","","","11","10.1016/j.jobe.2023.107671","https://www.scopus.com/inward/record.uri?eid=2-s2.0-85170103328&doi=10.1016%2fj.jobe.2023.107671&partnerID=40&md5=611cf8b9a3c934dd3c75003795fd38dd","JSPS International Research Fellow, Department of Architecture and Architectural Engineering, Kyoto University, Kyoto, Japan; Department of Civil and Environmental Engineering, The Hong Kong Polytechnic University, Kowloon, Hong Kong","Hu S., JSPS International Research Fellow, Department of Architecture and Architectural Engineering, Kyoto University, Kyoto, Japan; Lei X., Department of Civil and Environmental Engineering, The Hong Kong Polytechnic University, Kowloon, Hong Kong","Self-centering systems have emerged as innovative lateral force-resisting mechanisms aimed at improving the earthquake resilience of building structures. The fully self-centering behavior effectively eliminates the residual deformation, thereby improving the post-earthquake repairability of building structures. However, this behavior does intensify floor acceleration responses that contribute to nonstructural damage and lead to increased initial costs. This research aims to develop a general machine learning and genetic algorithm-based framework for optimizing the design of self-centering building structures and to strike a balance between the initial costs and seismic losses by minimizing the overall life-cycle cost. The artificial neural network (ANN) based StructureNet model was developed for accelerating the calculation of life-cycle costs associated with self-centering structures. The genetic algorithm was adopted to determine the optimal design parameters for self-centering structures. The framework was applied to 8 design cases, with the analysis centering on two factors: the maximum allowable residual inter-story drift for controlling demolition and the initial construction cost of self-centering members. The study examined their influences on the optimization design results of self-centering building structures. The findings highlight a preference for a design approach that leans toward partially self-centering behavior as opposed to fully self-centering behavior, indicating the higher life-cycle benefits of partially self-centering behavior. © 2023 Elsevier Ltd","ANN; Genetic algorithm; Life-cycle cost; Optimal design; Partially self-centering behavior; Self-centering","Architectural design; Cost benefit analysis; Earthquakes; Learning algorithms; Life cycle; Machine learning; Neural networks; Optimal systems; Seismic design; Building structure; Centering behavior; Initial costs; Life-cycle cost; Machine-learning; Optimal design; Partially self-centering behavior; Self centering; Self-centering system; Genetic algorithms","Japan Society for the Promotion of Science, KAKEN; Hong Kong Polytechnic University, PolyU","Funding text 1: The first author (Dr. Shuling Hu) would like to thank Prof. Songye Zhu at The Hong Kong Polytechnic University for his kind and professional support and help. The financial support from the Japan Society for the Promotion of Science (JSPS) is greatly acknowledged.; Funding text 2: The first author (Dr. Shuling Hu) would like to thank Prof. Songye Zhu at The Hong Kong Polytechnic University for his kind and professional support and help. The financial support from the Japan Society for the Promotion of Science (JSPS) is greatly acknowledged. ","X. Lei; Department of Civil and Environmental Engineering, The Hong Kong Polytechnic University, Kowloon, Hong Kong, China; email: leixiaoming@outlook.com","","Elsevier Ltd","23527102","","","","English","J. Build. Eng.","Article","Final","","Scopus","2-s2.0-85170103328"
"Naser A.Z.; Defersha F.; Pei E.; Zhao Y.F.; Yang S.","Naser, Ahmed Z. (56490389300); Defersha, Fantahun (14035061800); Pei, Eujin (37052624500); Zhao, Yaoyao Fiona (57196241702); Yang, Sheng (56566856900)","56490389300; 14035061800; 37052624500; 57196241702; 56566856900","Toward automated life cycle assessment for additive manufacturing: A systematic review of influential parameters and framework design","2023","Sustainable Production and Consumption","41","","","253","274","21","5","10.1016/j.spc.2023.08.009","https://www.scopus.com/inward/record.uri?eid=2-s2.0-85169044633&doi=10.1016%2fj.spc.2023.08.009&partnerID=40&md5=5eaaaddec875126e9a2a24e936102c79","School of Engineering, University of Guelph, Guelph, N1G 2W1, ON, Canada; Brunel Design School, Brunel University London, Kingston Lane, Uxbridge, UB8 3PH, United Kingdom; Department of Mechanical Engineering, McGill University, Montreal, H3A 0G4, QC, Canada","Naser A.Z., School of Engineering, University of Guelph, Guelph, N1G 2W1, ON, Canada; Defersha F., School of Engineering, University of Guelph, Guelph, N1G 2W1, ON, Canada; Pei E., Brunel Design School, Brunel University London, Kingston Lane, Uxbridge, UB8 3PH, United Kingdom; Zhao Y.F., Department of Mechanical Engineering, McGill University, Montreal, H3A 0G4, QC, Canada; Yang S., School of Engineering, University of Guelph, Guelph, N1G 2W1, ON, Canada","Additive manufacturing (AM), a disruptive technology of building parts layer-by-layer directly from 3D models, has been considered a tempting cleaner production process compared to other conventional production routes. This is because AM has demonstrated impressive green characteristics which contributed to significantly reduced material and energy consumptions, a shorter supply chain, and diversion of the waste stream by reparation, etc. The majority of the current quantitative studies on the environmental assessment of AM are based on utilizing the knowledge-intensive Life Cycle Assessment (LCA) methodology. Further, current studies on assessing the environmental performance of AM are based on a limited selection of design- or process-related parameters. These knowledge barriers may cause delays and challenges in the selection of the optimal design and process parameters for additively manufactured parts. Such challenges are particularly prevalent during the product design and planning stages due to the iterative design-evaluation process. Therefore, there is a need for an automated LCA tool to support AM toward elevated sustainability. As such, this paper provides three main contributions to the research community. Firstly, this is the first study to identify a comprehensive set of influential AM design and process parameters that pose an impact on the environmental performance of AM. Secondly, this review also summarizes the impacts of each of these parameters on the environmental sustainability of AM. Lastly, to the best of the authors' knowledge, no work in the literature has been reported on automating LCA for AM. Thus, this paper promotes research toward a more environmentally benign and innovative AM technology by proposing a new framework to automate the environmental assessment of the process. The proposed framework is anticipated to take advantage of the fruitful integration between Machine Learning (ML) and the product process co-design concept to mitigate the challenges and limitations associated with the current LCA-based assessment tools. © 2023 Institution of Chemical Engineers","Additive manufacturing; Data-driven predictive model; Design and process parameters; Design for additive manufacturing; Life cycle assessment; Machine learning; Product-process co-design","3D printing; Additives; Carbon footprint; Environmental management; Environmental technology; Iterative methods; Machine learning; Pollution control; Product design; Supply chains; Sustainable development; Co-designs; Data driven; Data-driven predictive model; Design for additive manufacturing; Design parameters; Life cycle assessment; Machine-learning; Predictive models; Process parameters; Product process; Product-process co-design; Life cycle","Natural Sciences and Engineering Research Council of Canada, NSERC, (RGPIN-2022-03448); Natural Sciences and Engineering Research Council of Canada, NSERC","The study was supported by funding from the Natural Science and Engineering Research Council of Canada (NSERC) Discovery Grant ( RGPIN-2022-03448 ). The authors would like to acknowledge the invaluable contributions of the editorial board and reviewers who provided valuable insights, constructive feedback, and discerning suggestions.","S. Yang; School of Engineering, University of Guelph, Guelph, N1G 2W1, Canada; email: syang19@uoguelph.ca","","Elsevier B.V.","23525509","","","","English","Sustain. Prod. Consum.","Review","Final","","Scopus","2-s2.0-85169044633"
"Moreira R.; Martins J.S.B.; Carvalho T.C.M.B.; Silva F.O.","Moreira, Rodrigo (57201762405); Martins, Joberto S. B. (9839723000); Carvalho, Tereza C. M. B. (7005958557); Silva, Flávio de Oliveira (37123860700)","57201762405; 9839723000; 7005958557; 37123860700","On Enhancing Network Slicing Life-Cycle Through an AI-Native Orchestration Architecture","2023","Lecture Notes in Networks and Systems","654 LNNS","","","124","136","12","3","10.1007/978-3-031-28451-9_11","https://www.scopus.com/inward/record.uri?eid=2-s2.0-85151063055&doi=10.1007%2f978-3-031-28451-9_11&partnerID=40&md5=cdfad764c1be04b5de20bf4c52c4f783","Institute of Exact and Technological Sciences, Federal University of Viçosa, Rio Paranaíba, 38810-000, Brazil; UNIFACS, Salvador, 41820-020, Brazil; USP, São Paulo, 05508-010, Brazil; Faculty of Computing, Federal University of Uberlândia, Uberlândia, 38400-902, Brazil","Moreira R., Institute of Exact and Technological Sciences, Federal University of Viçosa, Rio Paranaíba, 38810-000, Brazil; Martins J.S.B., UNIFACS, Salvador, 41820-020, Brazil; Carvalho T.C.M.B., USP, São Paulo, 05508-010, Brazil; Silva F.O., Faculty of Computing, Federal University of Uberlândia, Uberlândia, 38400-902, Brazil","Legacy experimental network infrastructures can still host innovative services through novel network slicing orchestration architectures. Network slicing orchestration architectures available in state-of-the-art have building blocks that structurally change depending on the problem they are trying to solve. In these orchestrators, life-cycle functions of network slices experience advances on numerous fronts, such as combinatorial methods and Artificial Intelligence (AI). However, many of the state-of-the-art slicing architectures are not AI-native, making heterogeneity and the coexistence and use of machine learning paradigms for network slicing orchestration hard. Also, using AI in a non-native way makes network slice management a challenger and shallow. Hence, this paper proposes and evaluates a distributed AI-native slicing orchestration architecture that delivers machine learning capabilities in all life cycles of a network slice. Carried experiments suggest lower error using distributed machine learning models to predict Radio Access Network (RAN) resource consumption in slicing deployed over different target domains. © 2023, The Author(s), under exclusive license to Springer Nature Switzerland AG.","","Machine learning; Network architecture; Radio access networks; Building blockes; Combinatorial method; Distributed Artificial Intelligence; Learning paradigms; Life-cycle functions; Machine-learning; Network infrastructure; Network slicing; Non-native; State of the art; Life cycle","Fundação de Amparo à Pesquisa do Estado de São Paulo, FAPESP, (2018/23097-3); Conselho Nacional de Desenvolvimento Científico e Tecnológico, CNPq, (421944/2021-8, CNPq/MCTI/FNDCT 18/2021)","Acknowledgements. The author thanks the National Council for Scientific and Technological Development (CNPq) under grant number 421944/2021-8 (call CNPq/MCTI/FNDCT 18/2021), and the Research Support Foundation of the State of São Paulo (FAPESP) grant number 2018/23097-3, for the thematic project Slicing Future Internet Infrastructures (SFI2).","R. Moreira; Institute of Exact and Technological Sciences, Federal University of Viçosa, Rio Paranaíba, 38810-000, Brazil; email: rodrigo@ufv.br","Barolli L.","Springer Science and Business Media Deutschland GmbH","23673370","978-303128450-2","","","English","Lect. Notes Networks Syst.","Conference paper","Final","","Scopus","2-s2.0-85151063055"
"Sarkisian M.P.","Sarkisian, Mark P. (6603865682)","6603865682","The impact of Jin Mao Tower on life-cycle civil engineering of tall buildings","2022","Structure and Infrastructure Engineering","18","7","","895","932","37","3","10.1080/15732479.2022.2038644","https://www.scopus.com/inward/record.uri?eid=2-s2.0-85125325248&doi=10.1080%2f15732479.2022.2038644&partnerID=40&md5=a5dc68249ed13fbb5eb43c840de612dd","Skidmore, Owings & Merrill LLP, San Francisco, CA, United States","Sarkisian M.P., Skidmore, Owings & Merrill LLP, San Francisco, CA, United States","By 2030 the World Green Building Council has put forth a challenge that all buildings shall be designed for net zero operational carbon and by 2050 net zero embodied carbon. The construction of the Jin Mao Tower 20 years ago was unique for several reasons and ideas have resulted in progress toward those goals. At the time, it was the tallest building in China, one that resulted in re-writing the Chinese code for wind and seismic engineering but perhaps most importantly inspired the design of other buildings that would incorporate resilient systems. These systems have been designed based on a platform of thinking related to life-cycle engineering and minimal impact on the environment. Clearly conceived efficient tall building structural systems based on mega-columns interconnected with cores, friction-fused seismic systems, the application of optimization theories, and the considerations of carbon in construction were all influenced by the design of the Jin Mao Tower. This paper focuses on issues from research to build work that incorporate these ideas with visions of future opportunities. Techniques of calculating carbon will be discussed and ideas for the future contemplated considering machine learning and self-sustainability. © 2022 Informa UK Limited, trading as Taylor & Francis Group.","environmental impact; life-cycle; optimization; resilience; seismic design; Sustainable structural design; tall buildings","Architectural design; Carbon; Environmental impact; Life cycle; Seismology; Site selection; Sustainable development; Tall buildings; Building structural; Chinese codes; Embodied carbons; Green Building Council; Impact on the environment; Life cycle engineering; Optimisations; Resilience; Resilient systems; Sustainable structural design; Seismic design","","","M.P. Sarkisian; Skidmore, Owings Merrill LLP, San Francisco, United States; email: Mark.Sarkisian@som.com","","Taylor and Francis Ltd.","15732479","","","","English","Struct. Infrastructure Eng.","Article","Final","","Scopus","2-s2.0-85125325248"
"Shuaia H.; Wang J.; Wang A.; Zhang R.; Yang X.","Shuaia, Huiying (59068088400); Wang, Jiwen (59068589400); Wang, Anqi (59069097800); Zhang, Ran (59068088500); Yang, Xin (59069097900)","59068088400; 59068589400; 59069097800; 59068088500; 59069097900","Advances in Assuring Artificial Intelligence and Machine Learning Development Lifecycle and Their Applications in Aviation","2023","2023 5th International Academic Exchange Conference on Science and Technology Innovation, IAECST 2023","","","","861","867","6","1","10.1109/IAECST60924.2023.10503086","https://www.scopus.com/inward/record.uri?eid=2-s2.0-85192372769&doi=10.1109%2fIAECST60924.2023.10503086&partnerID=40&md5=e7be8b79653d9ab355ac0c1c0537fbc8","Aircraft Design and Research Institute of COMAC, Shanghai, China","Shuaia H., Aircraft Design and Research Institute of COMAC, Shanghai, China; Wang J., Aircraft Design and Research Institute of COMAC, Shanghai, China; Wang A., Aircraft Design and Research Institute of COMAC, Shanghai, China; Zhang R., Aircraft Design and Research Institute of COMAC, Shanghai, China; Yang X., Aircraft Design and Research Institute of COMAC, Shanghai, China","The use of Artificial Intelligence (AI) and Machine Learning(ML) in aviation has attracted attention from regulators. In order to prepare a means of compliance for the certification of trustworthiness AI within safety critical systems, this article reviews recent developments of aeronautical standard assuring AI development lifecycle and highlights three building blocks comprising the certification framework applicable to complex systems embedding ML components. To understand the challenges emerging during the development of ML models from the software engineering perspective, this article then presents the research of applying ML workflow in the development lifecycle of an intelligent Visual Guidance System(VGS) which is intended to guide the approach and landing in an emergency operation, by focusing on understanding how aircraft system and software designers could benefit from adapting the traditional engineering process to the ML-based approach and the necessary accommodations to support AI-enabled product certification. Finally, the practices of applying ML based approach are summarized, and the next steps of the research are given.  © 2023 IEEE.","Artificial Intelligence; Certification; Machine Learning; Runway Detection; Software Engineering","Air navigation; Application programs; Life cycle; Regulatory compliance; Safety engineering; Artificial intelligence learning; Building blockes; Certification; Embeddings; Engineering perspective; Learning-based approach; Machine learning models; Machine-learning; Runway detection; Safety critical systems; Machine learning","","","H. Shuaia; Aircraft Design and Research Institute of COMAC, Shanghai, China; email: shuaihuiying1@comac.cc; J. Wang; Aircraft Design and Research Institute of COMAC, Shanghai, China; email: wangjiwenwang@comac.cc","","Institute of Electrical and Electronics Engineers Inc.","","979-835035773-8","","","English","Int. Acad. Exch. Conf. Sci. Technol. Innov., IAECST","Conference paper","Final","","Scopus","2-s2.0-85192372769"
"Gao X.; Pishdad-Bozorgi P.","Gao, Xinghua (57199061792); Pishdad-Bozorgi, Pardis (55336914100)","57199061792; 55336914100","A framework of developing machine learning models for facility life-cycle cost analysis","2020","Building Research and Information","48","5","","501","525","24","24","10.1080/09613218.2019.1691488","https://www.scopus.com/inward/record.uri?eid=2-s2.0-85075404194&doi=10.1080%2f09613218.2019.1691488&partnerID=40&md5=d4c0036e1675720d79f738b6ea735b36","Myers-Lawson School of Construction, Virginia Polytechnic Institute and State University, Blacksburg, VA, United States; School of Building Construction, Georgia Institute of Technology, Atlanta, GA, United States","Gao X., Myers-Lawson School of Construction, Virginia Polytechnic Institute and State University, Blacksburg, VA, United States; Pishdad-Bozorgi P., School of Building Construction, Georgia Institute of Technology, Atlanta, GA, United States","Machine learning techniques have been used for predicting facility-related costs but there is a lack of research on developing machine learning models for the complete life-cycle cost (LCC) analysis of facilities. This research aims to systematically investigate the feasibility of forecasting facilities' LCC by implementing machine learning on historical data. The authors propose a comprehensive and generalizable framework for developing facility LCC analysis machine learning models. This framework specifies the data requirements, methods, and expected results in each step of the model development process. First, a literature review and a questionnaire survey were conducted to determine the independent variables affecting facility LCC and to identify the potential data sources. The process of using raw data to derive LCC components is then discussed. Finally, a proof-of-concept case study was conducted on a university campus to demonstrate the application of the proposed framework. This research concludes that current building systems already contain the data for LCC analysis and that the proposed framework is effective in facility LCC prediction. © 2019, © 2019 Informa UK Limited, trading as Taylor & Francis Group.","Data availability; facility management; life-cycle cost (LCC); machine learning","Costs; Forecasting; Learning systems; Life cycle; Machine learning; Office buildings; Surveys; Data availability; Facility management; Independent variables; Life cycle cost analysis; Life cycle costs (LCC); Machine learning models; Machine learning techniques; Questionnaire surveys; Cost benefit analysis","CDAIT, (4906638); Centre for the Development and Application of Internet of Things Technologies; Digital Building Laboratory; Georgia Institute of Technology, Georgia Tech","Funding text 1: This work was supported by the Digital Building Laboratory (DBL) at Georgia Institute of Technology and the Centre for the Development and Application of Internet of Things Technologies (CDAIT) at Georgia Institute of Technology (project No. 4906638). The authors appreciate all the members for their gracious support and input.; Funding text 2:  This work was supported by the Digital Building Laboratory (DBL) at Georgia Institute of Technology and the Centre for the Development and Application of Internet of Things Technologies (CDAIT) at Georgia Institute of Technology (project No. 4906638). The authors appreciate all the members for their gracious support and input. ","X. Gao; Myers-Lawson School of Construction, Virginia Polytechnic Institute and State University, Blacksburg, United States; email: xinghua@vt.edu","","Routledge","09613218","","BREIE","","English","Build Res Inf","Article","Final","","Scopus","2-s2.0-85075404194"
"Lamnatou C.; Cristofari C.; Chemisana D.","Lamnatou, Chr. (35076119800); Cristofari, C. (6602847961); Chemisana, D. (25959937200)","35076119800; 6602847961; 25959937200","Artificial Intelligence (AI) in relation to environmental life-cycle assessment, photovoltaics, smart grids and small-island economies","2024","Sustainable Energy Technologies and Assessments","71","","104005","","","","0","10.1016/j.seta.2024.104005","https://www.scopus.com/inward/record.uri?eid=2-s2.0-85206139528&doi=10.1016%2fj.seta.2024.104005&partnerID=40&md5=888def0980bfb1862ce28f7707f7881b","University of Lleida, Polytechnic School, Jaume II 69, Lleida, 25001, Spain; University of Corsica, UMR CNRS 6134, Research Centre Georges Peri, Route des Sanguinaires, Ajaccio, F-20000, France","Lamnatou C., University of Lleida, Polytechnic School, Jaume II 69, Lleida, 25001, Spain; Cristofari C., University of Corsica, UMR CNRS 6134, Research Centre Georges Peri, Route des Sanguinaires, Ajaccio, F-20000, France; Chemisana D., University of Lleida, Polytechnic School, Jaume II 69, Lleida, 25001, Spain","Considering the gaps in the literature on Artificial Intelligence (AI) modelling, this article aims to: i) present models that combine AI and environmental Life Cycle Assessment (LCA), ii) analyse the role of AI in photovoltaics, smart grids and small-island economies. The methodology used is based upon selection of publications and analysis. Regarding LCA/AI models, the results show that AI can anticipate environmental impacts but model performance depends on the amount of data available. LCA/AI models can be used for eco-design and decision-making. However, it is necessary to develop standardised methodologies to evaluate AI environmental impacts. Regarding AI and photovoltaics, AI provides remarkably interesting applications: design, optimisation and prediction of parameters related to different kinds of photovoltaics (concentrating, building-integrated, etc.). As for AI and smart grids, AI offers advantages such as integration of intermittent renewable energy sources and decentralised-grid management. With respect to AI and small-island economies, factors such as effective energy storage, energy plans and estimation of the degree of susceptibility to disasters are important. Generally speaking, and considering the above-mentioned issues, it can be argued that AI poses multiple challenges: machine-learning models on a large-scale basis; the internet of things; options to reduce negative environmental impacts and so on. © 2024 Elsevier Ltd","Artificial Intelligence (AI) models; Deep learning, machine learning; Life Cycle Assessment (LCA); Neural networks; Photovoltaics; Smart grids","Artificial intelligence  model; Deep learning, machine learning; Intelligence models; Learning machines; Life cycle assessment; Machine-learning; Neural-networks; Photovoltaics; Small island; Smart grid; artificial intelligence; environmental assessment; life cycle analysis; photovoltaic system; small island state; smart grid; Life cycle assessment","Institució Catalana de Recerca i Estudis Avançats, ICREA","The authors from Spain would like to thank the Spanish MCIN/AEI/10.13039/501100011033 for the funding (grant reference: PID2022-142601OB-I00; TED2021-132843B-I00). D. Chemisana thanks Instituci\u00F3 Catalana de Recerca i Estudis Avan\u00E7ats (ICREA) for the ICREA Acad\u00E8mia award. Chr. Lamnatou is an Associate Professor of the Serra H\u00FAnter programme.","C. Lamnatou; University of Lleida, Polytechnic School, Lleida, Jaume II 69, 25001, Spain; email: lamnatou@macs.udl.cat","","Elsevier Ltd","22131388","","","","English","Sustainable Energy Technol. Assess.","Review","Final","","Scopus","2-s2.0-85206139528"
