"Zheng L.; Mueller M.; Luo C.; Yan X.","Zheng, Lin (58512008800); Mueller, Markus (7402452416); Luo, Chunbo (55637616900); Yan, Xiaoyu (24484314900)","58512008800; 7402452416; 55637616900; 24484314900","Predicting whole-life carbon emissions for buildings using different machine learning algorithms: A case study on typical residential properties in Cornwall, UK","2024","Applied Energy","357","","122472","","","","7","10.1016/j.apenergy.2023.122472","https://www.scopus.com/inward/record.uri?eid=2-s2.0-85180417591&doi=10.1016%2fj.apenergy.2023.122472&partnerID=40&md5=3e85da1950f6db0242ab664f8bc7d449","Renewable Energy Group, Engineering Department, Faculty of Environment, Science and Economy, University of Exeter, Penryn Campus, Penryn, TR10 9FE, United Kingdom; Environment and Sustainability Institute, Faculty of Environment, Science and Economy, University of Exeter, Penryn Campus, Penryn, TR10 9FE, United Kingdom; Department of Earth and Environmental Sciences, Faculty of Environment, Science and Economy, University of Exeter, Penryn Campus, Penryn TR10 9FE, United Kingdom; Institute for Data Science and Artificial Intelligence, University of Exeter, Exeter, EX4 4RN, United Kingdom; Department of Computer Science, Faculty of Environment, Science and Economy, University of Exeter, Streatham Campus, Exeter, EX4 4RN, United Kingdom","Zheng L., Renewable Energy Group, Engineering Department, Faculty of Environment, Science and Economy, University of Exeter, Penryn Campus, Penryn, TR10 9FE, United Kingdom, Environment and Sustainability Institute, Faculty of Environment, Science and Economy, University of Exeter, Penryn Campus, Penryn, TR10 9FE, United Kingdom; Mueller M., Environment and Sustainability Institute, Faculty of Environment, Science and Economy, University of Exeter, Penryn Campus, Penryn, TR10 9FE, United Kingdom, Department of Earth and Environmental Sciences, Faculty of Environment, Science and Economy, University of Exeter, Penryn Campus, Penryn TR10 9FE, United Kingdom, Institute for Data Science and Artificial Intelligence, University of Exeter, Exeter, EX4 4RN, United Kingdom; Luo C., Institute for Data Science and Artificial Intelligence, University of Exeter, Exeter, EX4 4RN, United Kingdom, Department of Computer Science, Faculty of Environment, Science and Economy, University of Exeter, Streatham Campus, Exeter, EX4 4RN, United Kingdom; Yan X., Renewable Energy Group, Engineering Department, Faculty of Environment, Science and Economy, University of Exeter, Penryn Campus, Penryn, TR10 9FE, United Kingdom, Environment and Sustainability Institute, Faculty of Environment, Science and Economy, University of Exeter, Penryn Campus, Penryn, TR10 9FE, United Kingdom","Whole-life carbon emissions (WLCE) studies are critical in assessing the environmental impact of buildings and promoting sustainable design practices. However, existing methods for estimating WLCE are time-consuming and data-intensive, limiting their usefulness in the early building design stages. In response to this, this research introduces a novel approach by harnessing various machine learning algorithms to predict WLCE and WLCE intensity (normalised by floor area) for buildings. To evaluate the suitability of machine learning algorithms, we conducted an experiment involving ten algorithms to build the prediction models. These models were trained using data from 150 typical residential properties in Cornwall, UK, along with 28 features obtained from a comprehensive survey, including floor area, heating type, and occupant characteristics. The ten algorithms include Multiple Linear Regression, and non-linear algorithms such as Decision Tree, Random Forest. Performance evaluation metrics, such as coefficient of determination (R2), mean absolute error (MAE), means squared error (MSE), root-mean-square error (RMSE), and elapsed time, were employed. Our research contributes to the field by showcasing the effectiveness of machine learning models in predicting building WLCE. We reveal that all the tested machine learning algorithms have the capability to predict WLCE and WLCE intensity, non-linear models outperform linear ones, and the Random Forest (RF) model demonstrates superior performance in terms of accuracy, stability, and efficiency. This research encourages the integration of life cycle studies into the early design stage, even within tight building design schedules, offering practical guidance to architects and designers. Furthermore, these results also benefit a wide range of stakeholders, not only the architects but also the engineers, policymakers, and life cycle assessment (LCA) researchers, contributing to the advancement of data-driven sustainability approaches within the building sector. © 2023 The Authors","Carbon reduction; Data-driven approaches; Life cycle thinking; Machine learning algorithms; Sustainable building; Whole life carbon emissions","Cornwall; Architectural design; Binary alloys; Carbon; Decision trees; Environmental impact; Errors; Forecasting; Housing; Learning algorithms; Life cycle; Machine learning; Mean square error; Multiple linear regression; Sustainable development; Building design; Carbon emissions; Carbon reduction; Cornwall; Data-driven approach; Life cycle thinking; Machine learning algorithms; Property; Sustainable building; Whole life carbon emission; algorithm; architectural design; carbon emission; environmental impact; heating; life cycle analysis; machine learning; sustainability; Floors","England European Regional Development Fund, (05R16P00305, 05R18P02819); University of Exeter; China Scholarship Council, CSC","Lin Zheng would like to acknowledge the financial support for her PhD from the China Scholarship Council and the University of Exeter . We appreciate the support from Dr. Tamaryn Menneer from the University of Exeter , the Smartline Project ( England European Regional Development Fund , 05R16P00305 and 05R18P02819 ), in providing access to original data on the case study properties. ","X. Yan; University of Exeter, Penryn, Penryn Campus, TR10 9FE, United Kingdom; email: Xiaoyu.Yan@exeter.ac.uk","","Elsevier Ltd","03062619","","APEND","","English","Appl. Energy","Article","Final","All Open Access; Hybrid Gold Open Access","Scopus","2-s2.0-85180417591"
"Venkatraj V.; Dixit M.K.; Yan W.; Caffey S.; Sideris P.; Aryal A.","Venkatraj, V. (57205732134); Dixit, M.K. (35738451300); Yan, W. (7402221563); Caffey, S. (55347368800); Sideris, P. (35771654200); Aryal, A. (57196927135)","57205732134; 35738451300; 7402221563; 55347368800; 35771654200; 57196927135","Toward the application of a machine learning framework for building life cycle energy assessment","2023","Energy and Buildings","297","","113444","","","","7","10.1016/j.enbuild.2023.113444","https://www.scopus.com/inward/record.uri?eid=2-s2.0-85172473896&doi=10.1016%2fj.enbuild.2023.113444&partnerID=40&md5=9d67956ee4b1431c3d0eb7a1e407cee3","Department of Construction Science, Texas A&M University, College Station, 77843, TX, United States; Department of Architecture, Texas A&M University, College Station, 77843, TX, United States; Department of Civil Engineering, Texas A&M University, College Station, 77843, TX, United States","Venkatraj V., Department of Construction Science, Texas A&M University, College Station, 77843, TX, United States; Dixit M.K., Department of Construction Science, Texas A&M University, College Station, 77843, TX, United States; Yan W., Department of Architecture, Texas A&M University, College Station, 77843, TX, United States; Caffey S., Department of Architecture, Texas A&M University, College Station, 77843, TX, United States; Sideris P., Department of Civil Engineering, Texas A&M University, College Station, 77843, TX, United States; Aryal A., Department of Construction Science, Texas A&M University, College Station, 77843, TX, United States","The construction industry in the United States consumes more than 50% of the global energy supply per year, suggesting that significant efforts may be needed to reduce building energy demand and its carbon footprint. During their lifespans, buildings consume embodied energy (EE) and operational energy (OE). Building professionals, therefore, conduct life cycle energy assessments (LCEA) to quantify and understand the paradox and interconnectedness between EE and OE. Traditionally, simulation-based optimization techniques were used for design space exploration to identify a building design with the fewest energy implications. However, literature shows these data-driven approaches are often error-prone, time-consuming, and computationally expensive, and they fail to provide real-time feedback to the user. Moreover, EE and OE assessment tools are disjointed and suffer from interoperability issues. These limitations restrict design space exploration, which eventually hinders the design decision-making process. Over the last few years, the increased availability of building data has made machine learning (ML) techniques a popular choice for building performance assessments. Several articles have developed prediction models to assess or optimize OE. While this work is significant, studies utilizing ML techniques for building LCEA are lacking, mainly due to the unavailability of a large-scale LCEA database. In this paper, we propose a methodology to (1) generate a simulation-based building energy dataset for different building typologies using a parametric framework, (2) utilize the synthetically generated database to develop an ML-based prediction model to predict EE and OE, and (3) test the model using a case study. The case study results show that the model achieves high prediction performance using minimal inputs available during the early design phase. The results further indicate that ML techniques can be used by building designers with no or limited LCE expertise to instantaneously estimate building LCE performance and help them select design options with minimal LCE consumption. © 2023","Building life cycle energy assessment; Building load prediction; Building performance analysis; Embodied energy; Life cycle energy; Machine learning; Operating energy; Supervised learning","Architectural design; Construction industry; Decision making; Forecasting; Life cycle; Optimization; Statistical tests; Structural design; Supervised learning; Building life cycle; Building life cycle energy assessment; Building load; Building load prediction; Building performance analysis; Embodied energy; Energy assessment; Life cycle energies; Load predictions; Machine-learning; Operating energies; Carbon footprint","National Science Foundation, NSF, (2048093)","This material is based upon work partly supported by the National Science Foundation under Grant No. 2048093. Any opinions, findings, conclusions, or recommendations expressed in this material are those of the author and do not necessarily reflect the views of the National Science Foundation.","V. Venkatraj; Fremont, 38880 Guardino Dr., 94536, United States; email: varshavenkatraj@gmail.com","","Elsevier Ltd","03787788","","ENEBD","","English","Energy Build.","Article","Final","All Open Access; Bronze Open Access","Scopus","2-s2.0-85172473896"
"Venkatraj V.; Dixit M.K.","Venkatraj, V. (57205732134); Dixit, M.K. (35738451300)","57205732134; 35738451300","Challenges in implementing data-driven approaches for building life cycle energy assessment: A review","2022","Renewable and Sustainable Energy Reviews","160","","112327","","","","18","10.1016/j.rser.2022.112327","https://www.scopus.com/inward/record.uri?eid=2-s2.0-85125593544&doi=10.1016%2fj.rser.2022.112327&partnerID=40&md5=1f7be30fd72a26619bf25a9cf9b81590","Department of Construction Science, Texas A&M University, College Station, 77843, TX, United States","Venkatraj V., Department of Construction Science, Texas A&M University, College Station, 77843, TX, United States; Dixit M.K., Department of Construction Science, Texas A&M University, College Station, 77843, TX, United States","Over the last few decades, the construction sector's energy consumption has increased tremendously. Buildings consume both embodied energy (EE) and operational energy (OE) during their life cycle. EE is consumed by processes associated with construction, whereas OE is spent operating the building. Studies show that improving the operational efficiency of a building may have serious implications for EE. Building life cycle energy assessments (LCEA) is, therefore, essential to understanding the dichotomy between EE and OE. In recent years, increased availability and accessibility of large-scale data have made data-driven approaches a popular choice for building performance assessments. In this context, numerous review articles have highlighted and tracked current trends in building load prediction methods. While this work is significant, there remains a lack of reviews focusing on data-driven approaches from a building life cycle energy perspective. In this paper, we conduct a systematic review of literature to identify key factors hindering the application of machine learning techniques specifically for building LCEA. They include: (i) issues of data collection, quality, and availability; (ii) lack of standardized methodologies; and (iii) temporal representativeness and granularity of prediction. Finally, we discuss potential solutions, future directions, and research opportunities for data-driven LCEA research. © 2022","Building energy modelling; Building load prediction; Challenges; Data-driven; Embodied energy; Life cycle energy; Machine learning; Operating energy","Construction; Construction industry; Energy utilization; Forecasting; Life cycle; Machine learning; Building energy model; Building load; Building load prediction; Challenge; Data driven; Embodied energy; Life cycle energies; Load predictions; Machine-learning; Operating energies; Buildings","National Science Foundation, NSF, (2048093)","This study was partially supported by the National Science Foundation (NSF) grant number 2048093. The opinions, findings, and conclusions, or recommendations expressed are those of the author(s) and do not necessarily reflect the views of the National Science Foundation. ","V. Venkatraj; Department of Construction Science, Texas A&M University, College Station, 77843, United States; email: varshavenkatraj@gmail.com","","Elsevier Ltd","13640321","","RSERF","","English","Renewable Sustainable Energy Rev","Review","Final","All Open Access; Bronze Open Access","Scopus","2-s2.0-85125593544"
"Amini Toosi H.; Del Pero C.; Leonforte F.; Lavagna M.; Aste N.","Amini Toosi, Hashem (57203037947); Del Pero, Claudio (58637362200); Leonforte, Fabrizio (55798009900); Lavagna, Monica (55350862000); Aste, Niccolò (23468350800)","57203037947; 58637362200; 55798009900; 55350862000; 23468350800","Machine learning for performance prediction in smart buildings: Photovoltaic self-consumption and life cycle cost optimization","2023","Applied Energy","334","","120648","","","","25","10.1016/j.apenergy.2023.120648","https://www.scopus.com/inward/record.uri?eid=2-s2.0-85146672502&doi=10.1016%2fj.apenergy.2023.120648&partnerID=40&md5=fa01709175564eacdba005c2ddbe3e0a","Architecture, Built Environment and Construction Engineering Department, Politecnico di Milano, Via Ponzio 31, Milano, 20133, Italy","Amini Toosi H., Architecture, Built Environment and Construction Engineering Department, Politecnico di Milano, Via Ponzio 31, Milano, 20133, Italy; Del Pero C., Architecture, Built Environment and Construction Engineering Department, Politecnico di Milano, Via Ponzio 31, Milano, 20133, Italy; Leonforte F., Architecture, Built Environment and Construction Engineering Department, Politecnico di Milano, Via Ponzio 31, Milano, 20133, Italy; Lavagna M., Architecture, Built Environment and Construction Engineering Department, Politecnico di Milano, Via Ponzio 31, Milano, 20133, Italy; Aste N., Architecture, Built Environment and Construction Engineering Department, Politecnico di Milano, Via Ponzio 31, Milano, 20133, Italy","The application of Photovoltaic (PV) system in buildings is growing rapidly in response to the need for clean energy sources and building decarbonization targets. Nonetheless, enhancing PV self-consumption through technical solutions such as Energy Storage Systems (ESS) is getting higher importance to increase the profitability of PV plants, by minimizing the building-grid interaction. In this context, analyzing PV self-consumption of different energy storage configurations becomes more relevant and crucial in building energy modeling although it is heavily time-consuming and complicated, particularly within a multi-objective optimization related to the ESS design. As a solution to resolve this issue, this paper evaluates the accuracy, training, and prediction speed of 24 Machine Learning (ML) models to be used as surrogate models for analyzing PV self-consumption in smart buildings. Furthermore, the performance of short-term Thermal Energy Storage (TES) to increase PV self-consumption is assessed and presented using ML models. The results showed the Gaussian Process Regression (GPR), Neural Networks (NN) including bilayered and trilayered NN models, Support Vector Machines (SVM) including the fine gaussian and cubic SVM models, and Ensembles of Trees (EoT) as superior ML models. The results also revealed that TES systems can efficiently increase PV self-consumption in the building equipped with electric heat pumps to provide heating, cooling, and domestic hot water. Moreover, the TES size optimization regarding the Life Cycle Cost (LCC) showed that the LCC-based optimum TES size can yield 7.1% savings within 30 years of the building service life. The novelties of this research are first to provide a reference to select the most suitable ML models in predicting PV self-consumption, second to implement machine learning for analyzing the performance of short-term thermal energy storage to enhance PV self-consumption in buildings, and third to carry out an LCC-based optimization on TES size using ML-based prediction models. © 2023 Elsevier Ltd","Accuracy; LCC; Machine learning; Prediction; PV self-consumption; Thermal energy storage","Buildings; Cooling systems; Costs; Heat storage; Life cycle; Multiobjective optimization; Support vector machines; Thermal energy; Accuracy; In-buildings; Life cycle cost; Machine learning models; Machine-learning; Performance; Photovoltaic self-consumption; Photovoltaics; Storage systems; Thermal energy storage; accuracy assessment; building; cost analysis; energy storage; life cycle analysis; machine learning; performance assessment; photovoltaic system; prediction; Forecasting","European Commission, EC; Horizon 2020, (768921)","This study and project are financially supported by EU Research and Innovation programme Horizon 2020 through number 768921 – HEART. The authors would like to thank the European Commission for enabling the funding of this project. ","H. Amini Toosi; Architecture, Built Environment and Construction Engineering Department, Politecnico di Milano, Milano, Via Ponzio 31, 20133, Italy; email: hashem.amini@polimi.it","","Elsevier Ltd","03062619","","APEND","","English","Appl. Energy","Article","Final","All Open Access; Green Open Access","Scopus","2-s2.0-85146672502"
"Gao X.; Pishdad-Bozorgi P.; Shelden D.; Tang S.","Gao, Xinghua (57199061792); Pishdad-Bozorgi, Pardis (55336914100); Shelden, Dennis (24449549000); Tang, Shu (57205632112)","57199061792; 55336914100; 24449549000; 57205632112","Machine Learning-Based Building Life-Cycle Cost Prediction: A Framework and Ontology","2020","Construction Research Congress 2020: Computer Applications - Selected Papers from the Construction Research Congress 2020","","","","1096","1105","9","1","","https://www.scopus.com/inward/record.uri?eid=2-s2.0-85096800308&partnerID=40&md5=c5226a5b162bd5a31ec4d95330414197","Myers-Lawson School of Construction, Virginia Polytechnic Institute and State Univ., Blacksburg, VA, United States","Gao X., Myers-Lawson School of Construction, Virginia Polytechnic Institute and State Univ., Blacksburg, VA, United States; Pishdad-Bozorgi P., Myers-Lawson School of Construction, Virginia Polytechnic Institute and State Univ., Blacksburg, VA, United States; Shelden D., Myers-Lawson School of Construction, Virginia Polytechnic Institute and State Univ., Blacksburg, VA, United States; Tang S., Myers-Lawson School of Construction, Virginia Polytechnic Institute and State Univ., Blacksburg, VA, United States","Numerous costs are associated with the design, construction, installation, operation, maintenance, and deconstruction of a building or building system. One of the challenges usually faced by an organization's capital planning department and/or facility management department is that they do not have an effective means to quickly estimate a new facility's whole life-cycle costs (LCC) during the programming phase when no building design is available. To provide facility managers and owners with an effective and reliable means to assess the total cost of the facility ownership, the authors are developing an approach that uses the historical data stored in multiple building systems and building information models (BIM) as basis to predict facilities' LCC - initial design and construction cost, utility cost, and operation and maintenance cost. In this paper, the authors propose a machine learning-enabled facility LCC analysis framework using data provided by building systems. The corresponding domain ontology - LCCA-Onto - is also presented. The proposed approach provides organizations who own multiple facilities with an innovative solution to the LCC prediction issue. © 2020 American Society of Civil Engineers.","","Construction; Cost benefit analysis; Costs; Forecasting; Life cycle; Machine learning; Office buildings; Ontology; Predictive analytics; Turing machines; Analysis frameworks; Building Information Model - BIM; Building life cycle; Facility management; Innovative solutions; Multiple buildings; Multiple facilities; Operation and maintenance; Architectural design","","","","Tang P.; Grau D.; El Asmar M.","American Society of Civil Engineers (ASCE)","","978-078448286-5","","","English","Constr. Res. Congr.: Comput. Appl. - Sel. Papers Constr. Res. Congr.","Conference paper","Final","","Scopus","2-s2.0-85096800308"
