"作者","Author full names","作者 ID","文献标题","年份","来源出版物名称","卷","期","论文编号","起始页码","结束页码","页码计数","施引文献","DOI","链接","归属机构","带归属机构的作者","摘要","作者关键字","索引关键字","出资详情","资金资助文本","通讯地址","编者","出版商","ISSN","ISBN","CODEN","PubMed ID","原始文献语言","来源出版物名称缩写","文献类型","出版阶段","开放获取","来源出版物","EID"
"Elomari Y.; Mateu C.; Marín-Genescà M.; Boer D.","Elomari, Youssef (57872871100); Mateu, Carles (15056164500); Marín-Genescà, M. (38661445400); Boer, Dieter (7003615369)","57872871100; 15056164500; 38661445400; 7003615369","A data-driven framework for designing a renewable energy community based on the integration of machine learning model with life cycle assessment and life cycle cost parameters","2024","Applied Energy","358","","122619","","","","10","10.1016/j.apenergy.2024.122619","https://www.scopus.com/inward/record.uri?eid=2-s2.0-85182275554&doi=10.1016%2fj.apenergy.2024.122619&partnerID=40&md5=ffcb2addc4b88c6aaf00f234e5e0eaf2","Departament d'Enginyeria Mecànica, Universitat Rovira i Virgili, Av. Països Catalans 26, Tarragona, 43007, Spain; Department of Computer Science and Industrial Engineering, University of Lleida, Lleida, 25001, Spain","Elomari Y., Departament d'Enginyeria Mecànica, Universitat Rovira i Virgili, Av. Països Catalans 26, Tarragona, 43007, Spain; Mateu C., Departament d'Enginyeria Mecànica, Universitat Rovira i Virgili, Av. Països Catalans 26, Tarragona, 43007, Spain, Department of Computer Science and Industrial Engineering, University of Lleida, Lleida, 25001, Spain; Marín-Genescà M., Departament d'Enginyeria Mecànica, Universitat Rovira i Virgili, Av. Països Catalans 26, Tarragona, 43007, Spain; Boer D., Departament d'Enginyeria Mecànica, Universitat Rovira i Virgili, Av. Països Catalans 26, Tarragona, 43007, Spain","This research paper presents a data-driven framework for design optimization of renewable energy communities (RECs) in the residential sector, considering both techno-economic challenges and environmental impact. The study's focus is to determine suitable sizes for photovoltaic systems, wind turbines, and battery electrical energy systems by evaluating energy, economic, and environmental criteria. To achieve this, we develop a data-driven model that incorporates Homer Pro and an in-house tool developed in Python programming language that integrates a machine learning algorithm, life cycle cost (LCC), life cycle assessment (LCA) calculations of the REC model. Furthermore, a multi-objective optimization model is established to minimize the LCC and LCA parameters while maximizing green energy use. Moreover, a multi-criteria decision-making approach based on Weighted Sum Model (WSM) is proposed to help the stakeholders to see beyond the selection criteria based on LCC and LCA to choose the most appropriate scenario optimal solution for the desired energy community and interpret the effect of various economic parameters on the sustainable performance of REC. The framework application is illustrated through a case study for the optimal design of REC for a residential community in Tarragona, Spain, consisting of 100 buildings. The results revealed a substantial improvement in economic and environmental benefits for designing REC, the optimal minimum cost solution with a levelized cost of energy (LCOE = 0.044 $/kWh) and a payback period of 7.1 years with an LCOE reduction of 85.04% compared to the base case. The minimum impact with an LCOE = 0.220 $/kWh and a payback period of 12.5 years with a reduction in environmental impact of 54.59% compared to the base case. Overall, the developed data-driven provides policy decision-making with an evaluation of REC in the residential sector. © 2024 The Authors","Energy community; Life cycle assessment; Life cycle cost; Machine learning; Multi-criteria decision making; Multi-objective optimization; Optimization","Spain; Costs; Decision making; Economic and social effects; Energy utilization; Environmental impact; Housing; Investments; Learning algorithms; Machine learning; Multiobjective optimization; Optimal systems; Energy; Energy community; Life cycle assessment; Life cycle cost; Machine-learning; Multi criteria decision-making; Multi-objectives optimization; Multicriteria decision-making; Multicriterion decision makings; Optimisations; alternative energy; environmental impact; integrated approach; life cycle analysis; multicriteria analysis; parameter estimation; spatiotemporal analysis; Life cycle","European Union NextGenerationEU/PRTR; Ministerio de Ciencia, Innovación y Universidades, MCIU, (MCIN/AEI/10.13039/501100011033, PID2021-123511OB-C31, PID2021-123511OB-C33, PID2021-124139NB-C22, PID2021-127713OA-I00, TED2021-129851B-I00); Ministerio de Ciencia, Innovación y Universidades, MCIU","The authors would like to acknowledge financial support from the “ Ministerio de Ciencia, Innovación y Universidades ” of Spain ( PID2021-127713OA-I00 , PID2021-123511OB-C31 , PID2021-123511OB-C33 , PID2021-124139NB-C22 funded by MCIN/AEI/10.13039/501100011033/FEDER, UE & TED2021-129851B-I00 funded by MCIN/AEI/10.13039/501100011033 and by the “European Union NextGenerationEU/PRTR).","D. Boer; Departament d'Enginyeria Mecànica, Universitat Rovira i Virgili, Tarragona, Av. Països Catalans 26, 43007, Spain; email: dieter.boer@urv.cat","","Elsevier Ltd","03062619","","APEND","","English","Appl. Energy","Article","Final","All Open Access; Hybrid Gold Open Access","Scopus","2-s2.0-85182275554"
"Adewale B.A.; Ene V.O.; Ogunbayo B.F.; Aigbavboa C.O.","Adewale, Bukola Adejoke (57202012608); Ene, Vincent Onyedikachi (59318881700); Ogunbayo, Babatunde Fatai (57200441689); Aigbavboa, Clinton Ohis (54956705100)","57202012608; 59318881700; 57200441689; 54956705100","A Systematic Review of the Applications of AI in a Sustainable Building’s Lifecycle","2024","Buildings","14","7","2137","","","","3","10.3390/buildings14072137","https://www.scopus.com/inward/record.uri?eid=2-s2.0-85199654006&doi=10.3390%2fbuildings14072137&partnerID=40&md5=74c2da201fd2cdd9091d5a4e0f23a60f","Department of Architecture, College of Science and Technology, Covenant University, Ogun State, Ota, 112104, Nigeria; Cidb Centre of Excellence & Sustainable Human Settlement and Construction Research Centre, Faculty of Engineering and the Built Environment, University of Johannesburg, Johannesburg, 2006, South Africa","Adewale B.A., Department of Architecture, College of Science and Technology, Covenant University, Ogun State, Ota, 112104, Nigeria, Cidb Centre of Excellence & Sustainable Human Settlement and Construction Research Centre, Faculty of Engineering and the Built Environment, University of Johannesburg, Johannesburg, 2006, South Africa; Ene V.O., Department of Architecture, College of Science and Technology, Covenant University, Ogun State, Ota, 112104, Nigeria; Ogunbayo B.F., Cidb Centre of Excellence & Sustainable Human Settlement and Construction Research Centre, Faculty of Engineering and the Built Environment, University of Johannesburg, Johannesburg, 2006, South Africa; Aigbavboa C.O., Cidb Centre of Excellence & Sustainable Human Settlement and Construction Research Centre, Faculty of Engineering and the Built Environment, University of Johannesburg, Johannesburg, 2006, South Africa","Buildings significantly contribute to global energy consumption and greenhouse gas emissions. This systematic literature review explores the potential of artificial intelegence (AI) to enhance sustainability throughout a building’s lifecycle. The review identifies AI technologies applicable to sustainable building practices, examines their influence, and analyses implementation challenges. The findings reveal AI’s capabilities in optimising energy efficiency, enabling predictive maintenance, and aiding in design simulation. Advanced machine learning algorithms facilitate data-driven analysis, while digital twins provide real-time insights for decision-making. The review also identifies barriers to AI adoption, including cost concerns, data security risks, and implementation challenges. While AI offers innovative solutions for energy optimisation and environmentally conscious practices, addressing technical and practical challenges is crucial for its successful integration in sustainable building practices. © 2024 by the authors.","artificial intelligence; building lifecycle; design optimization; digital twins; Internet of Things; sustainability","Architectural design; Decision making; Energy efficiency; Energy utilization; Gas emissions; Greenhouse gases; Intelligent buildings; Learning algorithms; Life cycle; Machine learning; Sustainable development; Building life cycle; Building practices; Design optimization; Energy-consumption; Global energy; Greenhouse gas emissions; Optimizing energy; Sustainable building; Systematic literature review; Systematic Review; Internet of things","","","V.O. Ene; Department of Architecture, College of Science and Technology, Covenant University, Ota, Ogun State, 112104, Nigeria; email: vincent.enepgs@stu.cu.edu.ng","","Multidisciplinary Digital Publishing Institute (MDPI)","20755309","","","","English","Buildings","Review","Final","All Open Access; Gold Open Access","Scopus","2-s2.0-85199654006"
"Xikai M.; Lixiong W.; Jiwei L.; Xiaoli Q.; Tongyao W.","Xikai, Mao (57211337209); Lixiong, Wang (56594754500); Jiwei, Li (54387098400); Xiaoli, Quan (57211341482); Tongyao, Wu (57211342620)","57211337209; 56594754500; 54387098400; 57211341482; 57211342620","Comparison of regression models for estimation of carbon emissions during building's lifecycle using designing factors: a case study of residential buildings in Tianjin, China","2019","Energy and Buildings","204","","109519","","","","48","10.1016/j.enbuild.2019.109519","https://www.scopus.com/inward/record.uri?eid=2-s2.0-85073550743&doi=10.1016%2fj.enbuild.2019.109519&partnerID=40&md5=5d7098634e115b77b453cd66fc7a678f","School of Architecture, Tianjin University, Tianjin, 300072, China; College of Civil Engineering and Architecture, Hebei University, Baoding, 071002, China","Xikai M., School of Architecture, Tianjin University, Tianjin, 300072, China; Lixiong W., School of Architecture, Tianjin University, Tianjin, 300072, China; Jiwei L., School of Architecture, Tianjin University, Tianjin, 300072, China, College of Civil Engineering and Architecture, Hebei University, Baoding, 071002, China; Xiaoli Q., School of Architecture, Tianjin University, Tianjin, 300072, China; Tongyao W., School of Architecture, Tianjin University, Tianjin, 300072, China","Many studies have been conducted on life cycle assessment and control measures for carbon emissions of buildings. Methods proposed by these studies usually require not only specific accounting model, but also detailed inventory data, which is not available at early design stage. Seeing that the importance of design phase to carbon emissions during building's lifecycle, a study on regression model of carbon emissions using designing factors was done. Firstly, based on process analysis method, the carbon emissions of 207 residential buildings in Tianjin were calculated. The results show that annual carbon emissions per floor area are between 30 and 60 kgCO2/(m2•year), with manufacture phase and operation phase accounting for 11%–25% and 75%–87%, respectively. Then, correlation analysis and elastic net were used to determine 12 designing factors for predictive model; At last, four regression techniques, PCR, RF, MLP and SVR were used to develop regression models, respectively; comparison and process analysis of model development were given later. The results show that SVR has the optimal predictive accuracy among four models, its corresponding coefficient of determination can reach to 0.800. This regression model can be utilized to estimate carbon emissions based on designing factors, which can help designers make a strategic decision at early stage. © 2019","Building lifecycle; Carbon emissions; Predictive model; Residential building","Carbon; Ecodesign; Housing; Life cycle; Regression analysis; Building life cycle; Carbon emissions; Coefficient of determination; Correlation analysis; Life Cycle Assessment (LCA); Predictive modeling; Regression techniques; Residential building; Structural design","Hebei Institutions of Higher Education; National Basic Research Program of China (973 Program), (2016YFC0700201); National Basic Research Program of China (973 Program); Science and Technology Innovative Research Team in Higher Educational Institutions of Hunan Province, (QN2019187); Science and Technology Innovative Research Team in Higher Educational Institutions of Hunan Province","Funding text 1: This research was funded by the National Key Research and Development Program of China (Grant No. 2016YFC0700201) and Science and Technology Research Programs of the Hebei Institutions of Higher Education (QN2019187).; Funding text 2: This research was funded by the National Key Research and Development Program of China (Grant No. 2016YFC0700201 ) and Science and Technology Research Programs of the Hebei Institutions of Higher Education (QN2019187).  ","L. Jiwei; School of Architecture, Tianjin University, Tianjin, 300072, China; email: 47887840@qq.com","","Elsevier Ltd","03787788","","ENEBD","","English","Energy Build.","Article","Final","","Scopus","2-s2.0-85073550743"
"Pei W.; Biljecki F.; Stouffs R.","Pei, Wanyu (57219209543); Biljecki, Filip (55609188900); Stouffs, Rudi (6506322664)","57219209543; 55609188900; 6506322664","Techniques and tools for integrating building material stock analysis and life cycle assessment at the urban scale: A systematic literature review","2024","Building and Environment","262","","111741","","","","0","10.1016/j.buildenv.2024.111741","https://www.scopus.com/inward/record.uri?eid=2-s2.0-85197251848&doi=10.1016%2fj.buildenv.2024.111741&partnerID=40&md5=c0c3df8902eb6455d958a527d25408e7","Department of Architecture, College of Design and Engineering, National University of Singapore, 4 Architecture Dr, 117566, Singapore; Singapore-ETH Centre, 1 College Ave E, CREATE Tower, 138602, Singapore; Department of Real Estate, Business School, National University of Singapore, 15 Kent Ridge Drive, 119245, Singapore","Pei W., Department of Architecture, College of Design and Engineering, National University of Singapore, 4 Architecture Dr, 117566, Singapore, Singapore-ETH Centre, 1 College Ave E, CREATE Tower, 138602, Singapore; Biljecki F., Department of Architecture, College of Design and Engineering, National University of Singapore, 4 Architecture Dr, 117566, Singapore, Department of Real Estate, Business School, National University of Singapore, 15 Kent Ridge Drive, 119245, Singapore; Stouffs R., Department of Architecture, College of Design and Engineering, National University of Singapore, 4 Architecture Dr, 117566, Singapore","The urban building stock has a high demand for materials and energy, exerting tremendous pressure on natural resources. A current research trend is to integrate Building Material Stock (BMS) analysis with Life Cycle Assessment (LCA) to evaluate energy use, material stock/flows, and related environmental performance associated with the life cycle of building stocks. Compared with urban building energy modelling (UBEM), material-related analysis is a relatively new topic. Some studies applied new techniques and tools to improve the modelling and the dynamic evolution of the BMS system. However, there is a lack of comprehensive review studies summarising the recent publications on these applications. Therefore, this study conducts a comprehensive literature review, primarily focusing on examining the tools and techniques employed for integrating “BMS-LCA” at the urban scale. This review includes 99 articles chosen from a pool of 557 related papers (in the recent decade), systematically retrieved from Scopus and Web of Science, along with additional manual searches. Through a comprehensive bibliometric and content-based synthesis analysis of selected literature, this paper synthesises the techniques/tools used for effectively completing various analysis phases of “BMS-LCA”, including data collection and processing, stock modelling and analysis, and result evaluations. Key findings highlight the significance of integrating artificial intelligence and geospatial technology in optimising data collection, machine learning and data-driven models in enhancing building stock aggregation and classification, and innovative application of relevant LCA software and databases in facilitating BMS's LCA, etc. This review provides a valuable reference for researchers in future investigations, as it identifies novel ways of applying techniques/tools and opportunities for methodology improvement in the urban-level “BMS-LCA” study. © 2024 Elsevier Ltd","Building stock modelling; Material flow analysis; Material stock quantification; Systematic literature review","Application programs; Artificial intelligence; Classification (of information); Data acquisition; Data handling; Environmental management; Building stock modeling; Building stocks; Buildings materials; Material stock quantification; Materials flow analysis; Stock analysis; Stock models; Systematic literature review; Techniques and tools; Urban scale; construction material; future prospect; integrated approach; life cycle analysis; literature review; material flow analysis; performance assessment; quantitative analysis; research work; urban area; Life cycle","Eidgenössische Technische Hochschule Zürich, ETH; National Research Foundation Singapore, NRF; China Scholarship Council, CSC","The research was conducted at the Future Cities Lab Global at the Singapore-ETH Centre, which was established collaboratively between ETH Zurich and the National Research Foundation Singapore. This research is supported by the National Research Foundation Singapore (NRF) under its Campus for Research Excellence and Technological Enterprise (CREATE) program. The financial support the China Scholarship Council (CSC) provided to the first author, Wanyu Pei, is additionally acknowledged. We would like to express our sincere appreciation to the reviewers and editors for their insightful comments and suggestions, which greatly improved the quality of this review paper.","R. Stouffs; Department of Architecture, College of Design and Engineering, National University of Singapore, 4 Architecture Dr, 117566, Singapore; email: stouffs@nus.edu.sg","","Elsevier Ltd","03601323","","BUEND","","English","Build. Environ.","Review","Final","","Scopus","2-s2.0-85197251848"
"Ji S.; Lee B.; Yi M.Y.","Ji, Sukwon (57221636824); Lee, Bumho (57230460900); Yi, Mun Yong (7102961073)","57221636824; 57230460900; 7102961073","Building life-span prediction for life cycle assessment and life cycle cost using machine learning: A big data approach","2021","Building and Environment","205","","108267","","","","47","10.1016/j.buildenv.2021.108267","https://www.scopus.com/inward/record.uri?eid=2-s2.0-85113382104&doi=10.1016%2fj.buildenv.2021.108267&partnerID=40&md5=51fab6af1633bbae5991fdbb45190733","Graduate School of Knowledge Service Engineering, Department of Industrial & Systems Engineering, KAIST, South Korea","Ji S., Graduate School of Knowledge Service Engineering, Department of Industrial & Systems Engineering, KAIST, South Korea; Lee B., Graduate School of Knowledge Service Engineering, Department of Industrial & Systems Engineering, KAIST, South Korea; Yi M.Y., Graduate School of Knowledge Service Engineering, Department of Industrial & Systems Engineering, KAIST, South Korea","Life cycle assessment (LCA) and life cycle cost (LCC) are two primary methods used to assess the environmental and economic feasibility of building construction. An estimation of the building's life span is essential to carrying out these methods. However, given the diverse factors that affect the building's life span, it was estimated typically based on its main structural type. However, different buildings have different life spans. Simply assuming that all buildings with the same structural type follow an identical life span can cause serious estimation errors. In this study, we collected 1,812,700 records describing buildings built and demolished in South Korea, analysed the actual life span of each building, and developed a building life-span prediction model using deep-learning and traditional machine learning. The prediction models examined in this study produced root mean square errors of 3.72–4.6 and the coefficients of determination of 0.932–0.955. Among those models, a deep-learning based prediction model was found the most powerful. As anticipated, the conventional method of determining a building's life expectancy using a discrete set of specific factors and associated assumptions of life span did not yield realistic results. This study demonstrates that an application of deep learning to the LCA and LCC of a building is a promising direction, effectively guiding business planning and critical decision making throughout the construction process. © 2021 Elsevier Ltd","Big data; Building life span; Deep neural network; Life cycle assessment; Life cycle cost; Machine learning","South Korea; Big data; Buildings; Construction; Costs; Decision making; Deep neural networks; Forecasting; Mean square error; Planning; Building construction; Building life span; Economic feasibilities; Environmental feasibility; Estimation errors; Life span; Machine-learning; Neural-networks; Prediction model; Structural type; artificial neural network; building; cost analysis; data set; life cycle analysis; machine learning; prediction; Life cycle","","","M.Y. Yi; Graduate School of Knowledge Service Engineering, Department of Industrial & Systems Engineering, KAIST, South Korea; email: munyi@kaist.ac.kr","","Elsevier Ltd","03601323","","BUEND","","English","Build. Environ.","Article","Final","","Scopus","2-s2.0-85113382104"
"Sarkisian M.P.","Sarkisian, M.P. (6603865682)","6603865682","China’s important influence on world-wide life-cycle engineering","2020","Life-Cycle Civil Engineering: Innovation, Theory and Practice - Proceedings of the 7th International Symposium on Life-Cycle Civil Engineering, IALCCE 2020","","","","3","22","19","1","10.1201/9780429343292-1","https://www.scopus.com/inward/record.uri?eid=2-s2.0-85117387059&doi=10.1201%2f9780429343292-1&partnerID=40&md5=705d337c53176183514561fbf2344126","Skidmore, Owings and Merrill LLP, San Francisco, CA, United States","Sarkisian M.P., Skidmore, Owings and Merrill LLP, San Francisco, CA, United States","By 2030 the World Green Building Council has put forth a challenge that all buildings shall be designed for net zero operational carbon and by 2050 net zero embodied carbon. The construction of the Jin Mao Tower 20 years ago was unique for several reasons and ideas have resulted in progress toward those goals. At the time, it was the tallest building in China, one that resulted in re-writing the Chinese code for wind and seismic engineering but perhaps most importantly inspired the design of other buildings that would incorporate resilient systems. These systems have been designed based on a platform of thinking related to lifecycle engineering and minimal impact on the environment. Clearly conceived efficient tall building structural systems based on mega-columns interconnected with cores, friction-fused seismic systems, the application of optimization theories, and the considerations of carbon in construction were all influenced by the design of the Jin Mao Tower. The paper and presentation will focus from research to build work that incorporate these ideas with visions of future opportunities. Project examples from around the world will be highlighted including the Jin Mao Tower – Shanghai, the Tianjin World Financial Headquarters, the Huawei Headquarters, the Poly Beijing Headquarters, Beijing Finance Street among others. Techniques of calculating carbon will be discussed and ideas for the future contemplated considering machine learning and self-sustainability. © 2021 Taylor & Francis Group, London.","","Carbon; Life cycle; Seismic design; Seismology; Site selection; Sustainable development; Building structural; Chinese codes; Embodied carbons; Green Building Council; Impact on the environment; Life cycle engineering; Mega columns; Resilient systems; Seismic system; Structural systems; Tall buildings","","","","Chen A.; Ruan X.; Frangopol D.M.","CRC Press/Balkema","","978-036736019-1","","","English","Life-Cycle Civ. Eng.: Innov., Theory Practice - Proc. Int. Symp. Life-Cycle Civ. Eng., IALCCE","Conference paper","Final","","Scopus","2-s2.0-85117387059"
